{
  "schema": "ni.lock.v0",
  "locked_at": "2026-05-29T01:22:11Z",
  "previous_lock": {
    "path": ".ni/locks/20260529T012211Z-plan.lock.json",
    "sha256": "479c0cd818e183411abec7a79851b02846732472b3ab0488a25de2320e206d8c",
    "locked_at": "2026-05-28T06:43:35Z"
  },
  "source_of_truth": [
    ".ni/plan.lock.json",
    ".ni/contract.json",
    "docs/plan/**",
    ".ni/session.json",
    "chat history"
  ],
  "readiness": {
    "status": "READY"
  },
  "files": [
    {
      "path": ".ni/contract.json",
      "sha256": "3d5f7a6898dc0be9deb013acf65a992c9c64bacfb41bea23b138f81c8e27c64f"
    },
    {
      "path": "docs/plan/00_project_brief.md",
      "sha256": "a176c5342629697084f16f075e557562356b665ea5e19fa90ee14b2b34a54a41"
    },
    {
      "path": "docs/plan/01_actors_outcomes.md",
      "sha256": "cd12826389a15c5411c8a5b951e5fb664c6f63a999396490f390ea15fe411ec3"
    },
    {
      "path": "docs/plan/02_capabilities.md",
      "sha256": "e318cbea1d44fa61958762ce068e09fc75229ac5e4fb92e9029a0d7c95d9580b"
    },
    {
      "path": "docs/plan/03_interaction_contract.md",
      "sha256": "35880fafe4e30151367df4aa5f274cdecd53ee2e2615bd31ab8a9a569d923a47"
    },
    {
      "path": "docs/plan/04_domain_state.md",
      "sha256": "daee5ecb01c62b7988c92f165479754c0952bb074bf014861a4020cb69c03619"
    },
    {
      "path": "docs/plan/05_constraints.md",
      "sha256": "5a020f3a75c65d1bc98684843cce542603d3793cd42132813357c02419476fc6"
    },
    {
      "path": "docs/plan/06_risks_security.md",
      "sha256": "4db3718f140f7964e3b1d19f1ecc25dbf23b6076a3502105d3c09d0f8879b132"
    },
    {
      "path": "docs/plan/07_evaluation_contract.md",
      "sha256": "0c16a25624af001ecf86b8a54dc3ad8bb716fd1ae87c7a151d6a324b4630afcd"
    },
    {
      "path": "docs/plan/08_delivery_operation.md",
      "sha256": "5c1f7fc6f50f25ee570cc60ea1242dea2d00e657ee89ef8a2de6ccdb6c784ebc"
    },
    {
      "path": "docs/plan/09_execution_strategy.md",
      "sha256": "9645d586330d39a66f4b455041b58c72518274ad54a122ed1dc673b8071467fc"
    },
    {
      "path": "docs/plan/10_open_questions.md",
      "sha256": "8016bcff0e91cf458eec2a949b1fd594f49a31e621072c68480f7209f5aa04c0"
    },
    {
      "path": "docs/plan/11_decision_log.md",
      "sha256": "66b9c201aaa62fae91635d5d9227ae5338eb910f7eebae39f734dcc8dc4b79b2"
    }
  ]
}
