{
  "schema": "ni.lock.v0",
  "locked_at": "2026-05-29T07:24:18Z",
  "previous_lock": {
    "path": ".ni/locks/20260529T072418Z-plan.lock.json",
    "sha256": "bfc2909fecb0481f6e14c7933351a25c9b84e4b10b89780759a054697ac767ba",
    "locked_at": "2026-05-29T01:22:11Z"
  },
  "source_of_truth": [
    ".ni/plan.lock.json",
    ".ni/contract.json",
    "docs/plan/**",
    ".ni/session.json",
    "chat history"
  ],
  "readiness": {
    "status": "READY"
  },
  "files": [
    {
      "path": ".ni/contract.json",
      "sha256": "c8583a31b22e13fa2e6c9330f426d57ae6f7bc59ada8b8fb92b30625e6587100"
    },
    {
      "path": "docs/plan/00_project_brief.md",
      "sha256": "9b7c499aefd12506f5ae26f97592a8dc0c388a024d2624c9e23d2f3f0dec8603"
    },
    {
      "path": "docs/plan/01_actors_outcomes.md",
      "sha256": "cd12826389a15c5411c8a5b951e5fb664c6f63a999396490f390ea15fe411ec3"
    },
    {
      "path": "docs/plan/02_capabilities.md",
      "sha256": "28fa41d766e886651daf9525e58a075f24081d95a606809aae62472c3d6abe59"
    },
    {
      "path": "docs/plan/03_interaction_contract.md",
      "sha256": "35880fafe4e30151367df4aa5f274cdecd53ee2e2615bd31ab8a9a569d923a47"
    },
    {
      "path": "docs/plan/04_domain_state.md",
      "sha256": "daee5ecb01c62b7988c92f165479754c0952bb074bf014861a4020cb69c03619"
    },
    {
      "path": "docs/plan/05_constraints.md",
      "sha256": "52a2e7cf5ecdcc012ad87df5e62c0963bc603bd44a8c9288eee8454da524c2c0"
    },
    {
      "path": "docs/plan/06_risks_security.md",
      "sha256": "d55ed935541b4e86eeaba539d969898c73ffde244e7cd7af9e017dcb9dd25f2b"
    },
    {
      "path": "docs/plan/07_evaluation_contract.md",
      "sha256": "72d6aaf383b056c7f2666a4f2105ba545aaf4b717101480bde943d26edae7f2a"
    },
    {
      "path": "docs/plan/08_delivery_operation.md",
      "sha256": "be6e8c04bebd5d9f9021a28e403c0093c999d54babfab07b611525ad4f1ca913"
    },
    {
      "path": "docs/plan/09_execution_strategy.md",
      "sha256": "9645d586330d39a66f4b455041b58c72518274ad54a122ed1dc673b8071467fc"
    },
    {
      "path": "docs/plan/10_open_questions.md",
      "sha256": "8016bcff0e91cf458eec2a949b1fd594f49a31e621072c68480f7209f5aa04c0"
    },
    {
      "path": "docs/plan/11_decision_log.md",
      "sha256": "d756569860055c43091fd3ad8c43c0b5ff4715917b5ecb73430df1b71963b10a"
    }
  ]
}
