{
  "schema": "ni.lock.v0",
  "locked_at": "2026-05-27T12:45:16Z",
  "previous_lock": {
    "path": ".ni/locks/20260527T124516Z-plan.lock.json",
    "sha256": "b91f6afd41870a2965e2979abd9d979d980482a02b841300bb5b82aa7abe70c4",
    "locked_at": "2026-05-27T10:36:03Z"
  },
  "source_of_truth": [
    ".ni/plan.lock.json",
    ".ni/contract.json",
    "docs/plan/**",
    ".ni/session.json",
    "chat history"
  ],
  "readiness": {
    "status": "READY"
  },
  "files": [
    {
      "path": ".ni/contract.json",
      "sha256": "003454080a283ea1adf3b423872ffaafb490db5c0d7b413b00abfff5a3d537fd"
    },
    {
      "path": "docs/plan/00_project_brief.md",
      "sha256": "6df0a1bb41dc66e5bb38aec60516cf2b98a36b2cdc704a5db017eb117b554eff"
    },
    {
      "path": "docs/plan/01_actors_outcomes.md",
      "sha256": "cd12826389a15c5411c8a5b951e5fb664c6f63a999396490f390ea15fe411ec3"
    },
    {
      "path": "docs/plan/02_capabilities.md",
      "sha256": "cb53c93b7b6dc4632cbf419021b24e4defaba17cd0d34d8be35e4ba1a2ef3d5e"
    },
    {
      "path": "docs/plan/03_interaction_contract.md",
      "sha256": "35880fafe4e30151367df4aa5f274cdecd53ee2e2615bd31ab8a9a569d923a47"
    },
    {
      "path": "docs/plan/04_domain_state.md",
      "sha256": "daee5ecb01c62b7988c92f165479754c0952bb074bf014861a4020cb69c03619"
    },
    {
      "path": "docs/plan/05_constraints.md",
      "sha256": "d4babdf9f4cc3ee73f74ab41aa9f7bfaaf036af9e69725265ee760ddc0796c6d"
    },
    {
      "path": "docs/plan/06_risks_security.md",
      "sha256": "df9192f7744e2b1a044ac412263d0ba95cdfe4165d08a86fc3d41408e5601dae"
    },
    {
      "path": "docs/plan/07_evaluation_contract.md",
      "sha256": "c728742c6b8b95c45e46825943fc4b458e060bcf0eae79b4912b035bd926cb09"
    },
    {
      "path": "docs/plan/08_delivery_operation.md",
      "sha256": "ca760b70465565899c3abdfd43265b3b4fae1830bd438a570f2f008c0c4fe6f3"
    },
    {
      "path": "docs/plan/09_execution_strategy.md",
      "sha256": "9645d586330d39a66f4b455041b58c72518274ad54a122ed1dc673b8071467fc"
    },
    {
      "path": "docs/plan/10_open_questions.md",
      "sha256": "8016bcff0e91cf458eec2a949b1fd594f49a31e621072c68480f7209f5aa04c0"
    },
    {
      "path": "docs/plan/11_decision_log.md",
      "sha256": "3cbab93589e4347d3f28ec369bc728bd27c0492b99f450d1e6d92a5bd8f52110"
    }
  ]
}
