{
  "schema": "ni.lock.v0",
  "locked_at": "2026-05-27T15:51:42Z",
  "previous_lock": {
    "path": ".ni/locks/20260527T155142Z-plan.lock.json",
    "sha256": "e5cca21466fe5377b53a823f46e2d811a8f1d6cd281de49de73e4a0050bcf51c",
    "locked_at": "2026-05-27T14:39:28Z"
  },
  "source_of_truth": [
    ".ni/plan.lock.json",
    ".ni/contract.json",
    "docs/plan/**",
    ".ni/session.json",
    "chat history"
  ],
  "readiness": {
    "status": "READY"
  },
  "files": [
    {
      "path": ".ni/contract.json",
      "sha256": "8525df1d46a7e503591d390989aeed2807717527a209d443c905adc92d1228dc"
    },
    {
      "path": "docs/plan/00_project_brief.md",
      "sha256": "2d2cbab315349e09cf3786b26c7fedde614c42a5eaa25dd0410a55efdc26a35f"
    },
    {
      "path": "docs/plan/01_actors_outcomes.md",
      "sha256": "cd12826389a15c5411c8a5b951e5fb664c6f63a999396490f390ea15fe411ec3"
    },
    {
      "path": "docs/plan/02_capabilities.md",
      "sha256": "21920bbe7fc4ddf3e996c074a21d3490f05280148c2b8b9d927738b4384c16a8"
    },
    {
      "path": "docs/plan/03_interaction_contract.md",
      "sha256": "35880fafe4e30151367df4aa5f274cdecd53ee2e2615bd31ab8a9a569d923a47"
    },
    {
      "path": "docs/plan/04_domain_state.md",
      "sha256": "daee5ecb01c62b7988c92f165479754c0952bb074bf014861a4020cb69c03619"
    },
    {
      "path": "docs/plan/05_constraints.md",
      "sha256": "33239dd1a9e2bd53f72c872398875c898d0f5607c3d379c0dee7d18ce3da7b5d"
    },
    {
      "path": "docs/plan/06_risks_security.md",
      "sha256": "88006c8ecfcd6a9c8c95eb1f69e6bbf7757258375bdac7948b1306d9d8cf5a90"
    },
    {
      "path": "docs/plan/07_evaluation_contract.md",
      "sha256": "e1c88b22b9d27e7d1b4bf4492d4c9dbfe5875bc6d46c9e4407d74fe3abe38f87"
    },
    {
      "path": "docs/plan/08_delivery_operation.md",
      "sha256": "17413cbb6a0071161b7ee0eb4816ab920a5d98129c6e43d1885d5b6c2ec4a030"
    },
    {
      "path": "docs/plan/09_execution_strategy.md",
      "sha256": "9645d586330d39a66f4b455041b58c72518274ad54a122ed1dc673b8071467fc"
    },
    {
      "path": "docs/plan/10_open_questions.md",
      "sha256": "8016bcff0e91cf458eec2a949b1fd594f49a31e621072c68480f7209f5aa04c0"
    },
    {
      "path": "docs/plan/11_decision_log.md",
      "sha256": "9af0a3baf4e745039519cddad5f4ff455347f991fdd51a652b545af0c86e54f8"
    }
  ]
}
