{
  "schema": "ni.lock.v0",
  "locked_at": "2026-05-28T05:15:40Z",
  "previous_lock": {
    "path": ".ni/locks/20260528T051540Z-plan.lock.json",
    "sha256": "129afffefbbc0e78b1167f4ee971e524d2fc698fae22a73834cec4f9094787b4",
    "locked_at": "2026-05-27T15:51:42Z"
  },
  "source_of_truth": [
    ".ni/plan.lock.json",
    ".ni/contract.json",
    "docs/plan/**",
    ".ni/session.json",
    "chat history"
  ],
  "readiness": {
    "status": "READY"
  },
  "files": [
    {
      "path": ".ni/contract.json",
      "sha256": "736dbb789ea0161eedfb70d37bbe888e9144115fe06b470208944931f4c61896"
    },
    {
      "path": "docs/plan/00_project_brief.md",
      "sha256": "1d4ba39eeeefc76874ec6722e163c826a69310401f1683f3a743ef79788263bb"
    },
    {
      "path": "docs/plan/01_actors_outcomes.md",
      "sha256": "cd12826389a15c5411c8a5b951e5fb664c6f63a999396490f390ea15fe411ec3"
    },
    {
      "path": "docs/plan/02_capabilities.md",
      "sha256": "a5576af05da6f603325801e2469be669b55d590b863704509840b02d3eab8a68"
    },
    {
      "path": "docs/plan/03_interaction_contract.md",
      "sha256": "35880fafe4e30151367df4aa5f274cdecd53ee2e2615bd31ab8a9a569d923a47"
    },
    {
      "path": "docs/plan/04_domain_state.md",
      "sha256": "daee5ecb01c62b7988c92f165479754c0952bb074bf014861a4020cb69c03619"
    },
    {
      "path": "docs/plan/05_constraints.md",
      "sha256": "33239dd1a9e2bd53f72c872398875c898d0f5607c3d379c0dee7d18ce3da7b5d"
    },
    {
      "path": "docs/plan/06_risks_security.md",
      "sha256": "7151d637cdba79ad6e401454b3996c2b0561e5f4588338569f6563d3ca5764f5"
    },
    {
      "path": "docs/plan/07_evaluation_contract.md",
      "sha256": "498ec3fcb1510bb36b571bdea2002a2e5e04693a941bc179aee7ae54ce07026d"
    },
    {
      "path": "docs/plan/08_delivery_operation.md",
      "sha256": "7b04fe8c5f2265853298376ea90d7a21d4666fe1a0d83103f3bc79a95c460987"
    },
    {
      "path": "docs/plan/09_execution_strategy.md",
      "sha256": "9645d586330d39a66f4b455041b58c72518274ad54a122ed1dc673b8071467fc"
    },
    {
      "path": "docs/plan/10_open_questions.md",
      "sha256": "8016bcff0e91cf458eec2a949b1fd594f49a31e621072c68480f7209f5aa04c0"
    },
    {
      "path": "docs/plan/11_decision_log.md",
      "sha256": "ded0ffd22ead627c556909343dc0287fa31cef5efa2029a55be2cb5cd9bc2a43"
    }
  ]
}
