{
  "schema": "ni.lock.v0",
  "locked_at": "2026-05-28T06:43:35Z",
  "previous_lock": {
    "path": ".ni/locks/20260528T064335Z-plan.lock.json",
    "sha256": "c8e57836733bb788cfcf4c08e73e57bdac85e1a6da546923427c86a34d1ff40c",
    "locked_at": "2026-05-28T05:15:40Z"
  },
  "source_of_truth": [
    ".ni/plan.lock.json",
    ".ni/contract.json",
    "docs/plan/**",
    ".ni/session.json",
    "chat history"
  ],
  "readiness": {
    "status": "READY"
  },
  "files": [
    {
      "path": ".ni/contract.json",
      "sha256": "57d80362255f2c3f847bd052d9878084b5512649819c2a904cf66057d6ff95f1"
    },
    {
      "path": "docs/plan/00_project_brief.md",
      "sha256": "bb35c2d2786f20bcd67e9e850d0c923948b0244968d80ec2397e091274882fbc"
    },
    {
      "path": "docs/plan/01_actors_outcomes.md",
      "sha256": "cd12826389a15c5411c8a5b951e5fb664c6f63a999396490f390ea15fe411ec3"
    },
    {
      "path": "docs/plan/02_capabilities.md",
      "sha256": "a6201d067f11cf85120688281d606d2328c9891e771da0c09d2014787ed2ffe6"
    },
    {
      "path": "docs/plan/03_interaction_contract.md",
      "sha256": "35880fafe4e30151367df4aa5f274cdecd53ee2e2615bd31ab8a9a569d923a47"
    },
    {
      "path": "docs/plan/04_domain_state.md",
      "sha256": "daee5ecb01c62b7988c92f165479754c0952bb074bf014861a4020cb69c03619"
    },
    {
      "path": "docs/plan/05_constraints.md",
      "sha256": "33239dd1a9e2bd53f72c872398875c898d0f5607c3d379c0dee7d18ce3da7b5d"
    },
    {
      "path": "docs/plan/06_risks_security.md",
      "sha256": "8082996b4c67f100d601bd5f7141bd19fc6e2ceb5ea52156c1f9fc8599e9a494"
    },
    {
      "path": "docs/plan/07_evaluation_contract.md",
      "sha256": "d11b5aca732fbd904242ccc6d5b3f46fb9722f729030a51b699530ffa24bbf5e"
    },
    {
      "path": "docs/plan/08_delivery_operation.md",
      "sha256": "3c4e44edc501d3744c2f683fe74f71550d999aa120673f467b1f20c9c6032d35"
    },
    {
      "path": "docs/plan/09_execution_strategy.md",
      "sha256": "9645d586330d39a66f4b455041b58c72518274ad54a122ed1dc673b8071467fc"
    },
    {
      "path": "docs/plan/10_open_questions.md",
      "sha256": "8016bcff0e91cf458eec2a949b1fd594f49a31e621072c68480f7209f5aa04c0"
    },
    {
      "path": "docs/plan/11_decision_log.md",
      "sha256": "ba1312a025cb3195cfb672f07fde5c07714b2647b6834048175bc3f9ca59be9d"
    }
  ]
}
