{
  "schema": "ni.lock.v0",
  "locked_at": "2026-05-27T14:39:28Z",
  "previous_lock": {
    "path": ".ni/locks/20260527T143928Z-plan.lock.json",
    "sha256": "fdd3ff0f9ced38fe8908733bae4fa53733413b9dc4a618b33bb7bcef1ba303db",
    "locked_at": "2026-05-27T14:35:14Z"
  },
  "source_of_truth": [
    ".ni/plan.lock.json",
    ".ni/contract.json",
    "docs/plan/**",
    ".ni/session.json",
    "chat history"
  ],
  "readiness": {
    "status": "READY"
  },
  "files": [
    {
      "path": ".ni/contract.json",
      "sha256": "d4f71cebbe330c97540e2df55b6e9d6287699dbc5b372a7df73e41cbf4b8b7eb"
    },
    {
      "path": "docs/plan/00_project_brief.md",
      "sha256": "ab6db6e44b1d397f93e372e6ecb46710666ebee25b4f5f68720849f05c4156dc"
    },
    {
      "path": "docs/plan/01_actors_outcomes.md",
      "sha256": "cd12826389a15c5411c8a5b951e5fb664c6f63a999396490f390ea15fe411ec3"
    },
    {
      "path": "docs/plan/02_capabilities.md",
      "sha256": "fe9dcc3b025969105b69dbef6cc480e15bc819f031474514d8feccfcc90eb785"
    },
    {
      "path": "docs/plan/03_interaction_contract.md",
      "sha256": "35880fafe4e30151367df4aa5f274cdecd53ee2e2615bd31ab8a9a569d923a47"
    },
    {
      "path": "docs/plan/04_domain_state.md",
      "sha256": "daee5ecb01c62b7988c92f165479754c0952bb074bf014861a4020cb69c03619"
    },
    {
      "path": "docs/plan/05_constraints.md",
      "sha256": "8cd81fd2627b5e37c5ad7a7e1d025e29c161661f5c8097eb75d8f442e435081e"
    },
    {
      "path": "docs/plan/06_risks_security.md",
      "sha256": "b92a5027c69c45df6308a5624e6d9a9071d8efcf5c18a9ebdc4a447e7a83b6b7"
    },
    {
      "path": "docs/plan/07_evaluation_contract.md",
      "sha256": "8f2483b62d4674d795b6b3a606fa5eaad24c620f995ceca139a62c995d19bdff"
    },
    {
      "path": "docs/plan/08_delivery_operation.md",
      "sha256": "ca760b70465565899c3abdfd43265b3b4fae1830bd438a570f2f008c0c4fe6f3"
    },
    {
      "path": "docs/plan/09_execution_strategy.md",
      "sha256": "9645d586330d39a66f4b455041b58c72518274ad54a122ed1dc673b8071467fc"
    },
    {
      "path": "docs/plan/10_open_questions.md",
      "sha256": "8016bcff0e91cf458eec2a949b1fd594f49a31e621072c68480f7209f5aa04c0"
    },
    {
      "path": "docs/plan/11_decision_log.md",
      "sha256": "3aae6b04a18392f06ace7f8c2712830c73cc8bfd49a6b73de9a6323dd7c8b65e"
    }
  ]
}
