{
  "schema": "ni.lock.v0",
  "locked_at": "2026-05-26T13:53:54Z",
  "previous_lock": {
    "path": ".ni/locks/20260526T135354Z-plan.lock.json",
    "sha256": "bea43d93b8532224b13a0e8ddbee461ac73d9fef92092e182051008aeb22cfc7",
    "locked_at": "2026-05-26T09:50:56Z"
  },
  "source_of_truth": [
    ".ni/plan.lock.json",
    ".ni/contract.json",
    "docs/plan/**",
    "chat transcript",
    "model guess"
  ],
  "readiness": {
    "status": "READY"
  },
  "files": [
    {
      "path": ".ni/contract.json",
      "sha256": "3a17f334dc07ca0c318d53a90c73e7162bb35370e47ea67cd62302ca551474da"
    },
    {
      "path": "docs/plan/00_project_brief.md",
      "sha256": "b3616609aa5aca019e064ee2813472eb05885d4c23f0476218478f699ccdc180"
    },
    {
      "path": "docs/plan/01_actors_outcomes.md",
      "sha256": "0e2fc35fd13c5a8ec8fcb43e78e3340b25eaaa1b216a94de51eb49e36acf75b7"
    },
    {
      "path": "docs/plan/02_capabilities.md",
      "sha256": "a74c35e0239bcd2fca0b934d247e6f20c684fccce6491d49c2016e39ca6cd791"
    },
    {
      "path": "docs/plan/03_interaction_contract.md",
      "sha256": "35880fafe4e30151367df4aa5f274cdecd53ee2e2615bd31ab8a9a569d923a47"
    },
    {
      "path": "docs/plan/04_domain_state.md",
      "sha256": "d26ef2d8ce8a9e939b13d8b47a66b736aa52c6730c2d8630477cdbc8290523f8"
    },
    {
      "path": "docs/plan/05_constraints.md",
      "sha256": "41dc3e2e170e3e3566ac7016fa7ef1cf69161c8e486b81b17b3b6751f0290f68"
    },
    {
      "path": "docs/plan/06_risks_security.md",
      "sha256": "9828b1599891260c9e99a677e1ff1215b2980e945638d7c3d8cccb41caa15d16"
    },
    {
      "path": "docs/plan/07_evaluation_contract.md",
      "sha256": "61d4851f44e4a06bfa0044b76e23c95f2fc61140ba4d08382d709ae4965c56b6"
    },
    {
      "path": "docs/plan/08_delivery_operation.md",
      "sha256": "8330d93abe35bf848e3dd405bc1ca8fa328d84f0ab7483c255aaea40e9dd5529"
    },
    {
      "path": "docs/plan/09_execution_strategy.md",
      "sha256": "4a910766f5ee578c4e4a63cf80245d5e952a1981af727c46c8d00a8bc791c6cf"
    },
    {
      "path": "docs/plan/10_open_questions.md",
      "sha256": "8016bcff0e91cf458eec2a949b1fd594f49a31e621072c68480f7209f5aa04c0"
    },
    {
      "path": "docs/plan/11_decision_log.md",
      "sha256": "907d74ad538b53da33ebe0274a2997d0799d81ea80396a3272538058a1c7c4d3"
    }
  ]
}
