{
  "schema": "ni.lock.v0",
  "locked_at": "2026-05-26T13:56:17Z",
  "previous_lock": {
    "path": ".ni/locks/20260526T135617Z-plan.lock.json",
    "sha256": "f57202843d1d3a5d6908864944f515fcb9842775ced3023d29981914e016c72e",
    "locked_at": "2026-05-26T13:55:05Z"
  },
  "source_of_truth": [
    ".ni/plan.lock.json",
    ".ni/contract.json",
    "docs/plan/**",
    ".ni/session.json",
    "chat history"
  ],
  "readiness": {
    "status": "READY"
  },
  "files": [
    {
      "path": ".ni/contract.json",
      "sha256": "aca26a7a772d905e3e52aa28ffb02e6c53ecc2ff106b0f2677e6c236259e83a6"
    },
    {
      "path": "docs/plan/00_project_brief.md",
      "sha256": "b3616609aa5aca019e064ee2813472eb05885d4c23f0476218478f699ccdc180"
    },
    {
      "path": "docs/plan/01_actors_outcomes.md",
      "sha256": "0e2fc35fd13c5a8ec8fcb43e78e3340b25eaaa1b216a94de51eb49e36acf75b7"
    },
    {
      "path": "docs/plan/02_capabilities.md",
      "sha256": "3349097710a6c09239b79b48b710feaa7d0be955eb722357117888e8001b2339"
    },
    {
      "path": "docs/plan/03_interaction_contract.md",
      "sha256": "35880fafe4e30151367df4aa5f274cdecd53ee2e2615bd31ab8a9a569d923a47"
    },
    {
      "path": "docs/plan/04_domain_state.md",
      "sha256": "daee5ecb01c62b7988c92f165479754c0952bb074bf014861a4020cb69c03619"
    },
    {
      "path": "docs/plan/05_constraints.md",
      "sha256": "41769747a2c8492ccd48534a4d66332e7a5b6b065cf2c07ea01c6a8b39a23693"
    },
    {
      "path": "docs/plan/06_risks_security.md",
      "sha256": "9828b1599891260c9e99a677e1ff1215b2980e945638d7c3d8cccb41caa15d16"
    },
    {
      "path": "docs/plan/07_evaluation_contract.md",
      "sha256": "0e2f89212759ec23d8f5fe0decabe9b791dd2cffe8c645558e35948eabd94757"
    },
    {
      "path": "docs/plan/08_delivery_operation.md",
      "sha256": "8330d93abe35bf848e3dd405bc1ca8fa328d84f0ab7483c255aaea40e9dd5529"
    },
    {
      "path": "docs/plan/09_execution_strategy.md",
      "sha256": "4a910766f5ee578c4e4a63cf80245d5e952a1981af727c46c8d00a8bc791c6cf"
    },
    {
      "path": "docs/plan/10_open_questions.md",
      "sha256": "8016bcff0e91cf458eec2a949b1fd594f49a31e621072c68480f7209f5aa04c0"
    },
    {
      "path": "docs/plan/11_decision_log.md",
      "sha256": "907d74ad538b53da33ebe0274a2997d0799d81ea80396a3272538058a1c7c4d3"
    }
  ]
}
