{
  "schema": "ni.lock.v0",
  "locked_at": "2026-05-27T01:37:48Z",
  "previous_lock": {
    "path": ".ni/locks/20260527T013748Z-plan.lock.json",
    "sha256": "b0b4d582d8126ed40d11d5fd0b55e2bc533486719a1b95bd8972eacf4c121aa8",
    "locked_at": "2026-05-26T13:56:47Z"
  },
  "source_of_truth": [
    ".ni/plan.lock.json",
    ".ni/contract.json",
    "docs/plan/**",
    ".ni/session.json",
    "chat history"
  ],
  "readiness": {
    "status": "READY"
  },
  "files": [
    {
      "path": ".ni/contract.json",
      "sha256": "fef18cef04592993954f844efe9ddbe762fbdb58c056f6574f2297a60de073b2"
    },
    {
      "path": "docs/plan/00_project_brief.md",
      "sha256": "bad05b4cbcdbb25616b2d620c7fadfeeae1e22c41ebd14fb5a5521956d7f503a"
    },
    {
      "path": "docs/plan/01_actors_outcomes.md",
      "sha256": "13777d4f93bb667fe2abf8522ddcf7d333e262e4269e9c0f05805808851c6e41"
    },
    {
      "path": "docs/plan/02_capabilities.md",
      "sha256": "1b110f2d7acb27809d26c5ea3c5b49a57ae03f7738f341c2c3039c53a840f8f9"
    },
    {
      "path": "docs/plan/03_interaction_contract.md",
      "sha256": "35880fafe4e30151367df4aa5f274cdecd53ee2e2615bd31ab8a9a569d923a47"
    },
    {
      "path": "docs/plan/04_domain_state.md",
      "sha256": "daee5ecb01c62b7988c92f165479754c0952bb074bf014861a4020cb69c03619"
    },
    {
      "path": "docs/plan/05_constraints.md",
      "sha256": "b24b925f97360592d07d3eeb93d7fcd3ad4a64bf85c70a34a547b8858886de67"
    },
    {
      "path": "docs/plan/06_risks_security.md",
      "sha256": "effc7371d123cec16b78edd3e6843232b13f0ea71794cb8134b07f88114a3b79"
    },
    {
      "path": "docs/plan/07_evaluation_contract.md",
      "sha256": "fb0f75c7396c1d6c04da83270c30ab8ad5709d42d828ef7aeb3b551ea0e5d481"
    },
    {
      "path": "docs/plan/08_delivery_operation.md",
      "sha256": "034ced06947f86c4f92784fff833e552f2e2527f4d4eec80c005d55bbfcbc727"
    },
    {
      "path": "docs/plan/09_execution_strategy.md",
      "sha256": "4a910766f5ee578c4e4a63cf80245d5e952a1981af727c46c8d00a8bc791c6cf"
    },
    {
      "path": "docs/plan/10_open_questions.md",
      "sha256": "8016bcff0e91cf458eec2a949b1fd594f49a31e621072c68480f7209f5aa04c0"
    },
    {
      "path": "docs/plan/11_decision_log.md",
      "sha256": "7ef2a0a3971d95787d149308ea2035fa42b1fa3aceee4a235400968781482b18"
    }
  ]
}
